{
  "record_id": "demo-sim-0001",
  "kind": "simulated",
  "independent_group_id": null,
  "counts_as_new_biological_unit": false,
  "split": "train",
  "unit": "dimensionless",
  "value": 0.15,
  "source_uri": "urn:synthetic:fixed-function-demo",
  "license_status": "original-synthetic-example; repository license not selected",
  "parent_ids": [],
  "producer": {
    "artifact_id": "fixed-analytic-target",
    "version": "1",
    "fit_split": "not_fitted",
    "seed": 0
  }
}
